{
  "approved_selection_ids": [
    "direction-fbe9c254e174",
    "component-behavior-b5b98c543bc1"
  ],
  "blockers": [],
  "created_at": "2026-08-15T19:00:26Z",
  "current_phase": "look",
  "extensions": {
    "studio/behavior-correction-message-id": "1539259275254169642",
    "studio/behavior-hda": "work/studio/handoffs/study-003-affinity-direct-canvas-hda-v3/nonlocal-affinity-parallel.hda",
    "studio/behavior-hda-cohorts-enabled": false,
    "studio/behavior-hda-max-canvas-points": 500000,
    "studio/behavior-hda-receipt": "work/studio/handoffs/study-003-affinity-direct-canvas-hda-v3/handoff-receipt.json",
    "studio/behavior-hda-type": "bzor::nonlocal_affinity_parallel::1.2",
    "studio/behavior-promotion-message-id": "1538666235619704842",
    "studio/canonical-behavior-branch": "shallow-3D Parallel cohorts",
    "studio/canonical-behavior-component": "component-behavior-b5b98c543bc1",
    "studio/held-behavior-siblings": "Mixed cohorts; Neighbor braid",
    "studio/look-cache-frame-range": "201-650",
    "studio/look-cache-receipt": "studies/study_003_nonlocal-affinity-dance/01_behavior/03_selected/selection_002/cache_sequence/receipt.json",
    "studio/look-cache-rewiring": "deterministic rewiring continues through frame 650 and complete 960-step horizon",
    "studio/look-source": "studies/study_003_nonlocal-affinity-dance/01_behavior/03_selected/selection_002/look-source.json",
    "studio/look-setup": "basic",
    "studio/look-setup-source": "houdini/look_setups/basic/basic.hiplc",
    "studio/active-look-hip": "studies/study_003_nonlocal-affinity-dance/02_look/look.hiplc",
    "studio/look-workflow": "artist-led",
    "studio/migrated-from-session": "session-pilot-study-003-b84d90c7",
    "studio/pilot-study-003-role": "session"
  },
  "id": "study-003-nonlocal-affinity-dance",
  "idea_id": "idea-nonlocal-affinity-dance-b774404e",
  "intent": "Prove the source-faithful nonlocal affinity mechanism, freeze it as an ancestor, then depart into independently judged experimental animation systems.",
  "recommended_next_action": "KC completes Look Development in 02_look/look.hiplc, then identifies and locks the authoritative HIP for bounded rendering and direct Specimen/detail handoff.",
  "schema_version": 1,
  "selected_branch_id": "direction-fbe9c254e174",
  "state": "active",
  "title": "Study 003 \u2014 Non-Local Affinity",
  "unresolved_questions": [],
  "updated_at": "2026-08-21T10:04:44-04:00",
  "visibility": "private"
}
