{
 "approved_selection_ids": [],
 "blockers": [],
 "created_at": "2026-08-22T17:28:10Z",
 "current_phase": "delivery",
 "extensions": {
  "studio/active-look-hip": "studies/001-memory-field/02_look/look.hiplc",
  "studio/behavior-hda": "studies/001-memory-field/01_behavior/03_selected/refractory-route.hda",
  "studio/behavior-hda-audit": "studies/001-memory-field/01_behavior/03_selected/audit.json",
  "studio/behavior-hda-type": "bzor::refractory_route::1.0",
  "studio/behavior-revision": "refractory-route-ecology-v1",
  "studio/delivery-receipt": "studies/001-memory-field/04_delivery/bhvr_001_var_001_memory-field.delivery.json",
  "studio/delivery-video": "studies/001-memory-field/04_delivery/bhvr_001_var_001_memory-field.delivery.mp4",
  "studio/delivery-format": "15s 1080x1350 30fps",
  "studio/delivery-state": "post-ready",
  "studio/legacy-source": "studies/001-memory-field/study.json",
  "studio/legacy-study-id": "001-memory-field",
  "studio/look-format": "18.75s 1080x1350 24fps",
  "studio/look-record": "studies/001-memory-field/02_look/look.json",
  "studio/look-setup": "basic",
  "studio/look-setup-source": "houdini/look_setups/basic/basic.hiplc",
  "studio/look-workflow": "artist-led",
  "studio/promoted-select-count": 5,
  "studio/promoted-selects": "studies/001-memory-field/01_behavior/02_selects",
  "studio/prototype-era": true
 },
 "id": "study-001-memory-field",
 "intent": "Test whether agents following resource gradients while depositing slowly decaying inhibitory memory can create legible territories, escape routes, oscillation, and inherited environmental history.",
 "recommended_next_action": "Review the post-ready delivery. Public publishing remains a separate approval-gated action.",
 "schema_version": 1,
 "state": "active",
 "title": "Study 001 \u2014 Memory Field",
 "unresolved_questions": [],
 "updated_at": "2026-08-31T00:12:03Z",
 "visibility": "private"
}
